{"arrival_benchmark_ticks":101,"arrival_time":{"domain":"simulation","ns":1000},"code_commit":"non-empirical-step5-sample","data_hashes":{"synthetic_input":"0000000000000000000000000000000000000000000000000000000000000000"},"deadline_time":{"domain":"simulation","ns":2000},"episode_id":"step5-sample-episode","fee_schedule_id":"sample-fees-v1","impact_mode":"synthetic-exact-sample","instrument":"TEST-USD","latency_model_id":"sample-latency-v1","parent_quantity_lots":3,"queue_model_id":"exact-fifo","random_seed":0,"run_id":"step5-sample-run","schema_version":{"major":1,"minor":0},"side":"buy","strategy_id":"sample-policy","strategy_version":"1","venue":"synthetic"}
